{
  "$schema": "https://json-schema.org/draft/2020-12/schema",
  "$id": "urn:project-compass:decision:1.0",
  "title": "Compass explicit human decision v1",
  "type": "object",
  "additionalProperties": false,
  "required": [
    "schema_version",
    "idea_id",
    "decision_id",
    "report_revision_id",
    "supersedes_decision_id",
    "decided_at",
    "actor",
    "choice",
    "reason"
  ],
  "properties": {
    "schema_version": {
      "const": "1.0"
    },
    "idea_id": {
      "type": "string",
      "pattern": "^[A-Za-z0-9][A-Za-z0-9_-]{0,79}$"
    },
    "decision_id": {
      "type": "string",
      "pattern": "^[A-Za-z0-9][A-Za-z0-9_-]{0,79}$"
    },
    "report_revision_id": {
      "type": "string",
      "pattern": "^[A-Za-z0-9][A-Za-z0-9_-]{0,79}$"
    },
    "supersedes_decision_id": {
      "anyOf": [
        {
          "type": "string",
          "pattern": "^[A-Za-z0-9][A-Za-z0-9_-]{0,79}$"
        },
        {
          "type": "null"
        }
      ]
    },
    "decided_at": {
      "type": "string",
      "format": "date-time",
      "pattern": "^\\d{4}-\\d{2}-\\d{2}T\\d{2}:\\d{2}:\\d{2}(?:\\.\\d{3})?Z$"
    },
    "actor": {
      "type": "object",
      "additionalProperties": false,
      "required": [
        "kind",
        "id"
      ],
      "properties": {
        "kind": {
          "const": "human"
        },
        "id": {
          "type": "string",
          "pattern": "^[A-Za-z0-9][A-Za-z0-9_-]{0,79}$"
        }
      }
    },
    "choice": {
      "type": "string",
      "enum": [
        "build_small",
        "use_existing",
        "contribute",
        "pause",
        "stop"
      ]
    },
    "reason": {
      "type": "string",
      "minLength": 1,
      "maxLength": 12000
    }
  }
}
